[
  {
    "id": 1,
    "name": "Furina",
    "element": "Hydro",
    "rarity": 5,
    "weapon": "Sword",
    "region": "Fontaine",
    "role": "Sub-DPS",
    "birthday": "October 13",
    "about": "Furina de Fontaine is a playable Hydro character in Genshin Impact, initially introduced as the flamboyant and prideful Hydro Archon. Later revealed to be a public persona, she transitions to a humbler life as an actress and artistic consultant. Her ability to switch between Pneuma and Ousia states makes her versatile in combat, excelling as a Sub-DPS with strong support capabilities. Furina's theatrical demeanor hides a deep sense of responsibility for Fontaine's people.",
    "url_image": "https://upload-static.hoyoverse.com/hoyolab-wiki/2023/09/25/151578876/129c1cc128b848f9e5b45a3649a93ccd_7558186121887964453.jpeg?x-oss-process=image%2Fformat%2Cwebp",
    "url_icon": "https://cdn.wanderer.moe/genshin-impact/character-icons/ui-avataricon-furina.png"
  },
  {
    "id": 2,
    "name": "Hu Tao",
    "element": "Pyro",
    "rarity": 5,
    "weapon": "Polearm",
    "region": "Liyue",
    "role": "Main DPS",
    "birthday": "July 15",
    "about": "Hu Tao is a playable Pyro character in Genshin Impact, serving as the 77th Director of the Wangsheng Funeral Parlor in Liyue. Known for her eccentric and cheerful personality, she hides a serious dedication to her duties, ensuring the balance between life and death. A talented poet, her works are cherished by Liyue's citizens. In combat, Hu Tao excels as a Main DPS, dealing high Pyro damage with her polearm.",
    "url_image": "https://wiki.hoyolab.com/_ipx/f_webp/https://bbs.hoyolab.com/hoyowiki/picture/character/%25E8%2583%25A1%25E6%25A1%2583/avatar_header.jpg",
    "url_icon": "https://cdn.wanderer.moe/genshin-impact/character-icons/ui-avataricon-hutao.png"
  },
  {
    "id": 3,
    "name": "Ganyu",
    "element": "Cryo",
    "rarity": 5,
    "weapon": "Bow",
    "region": "Liyue",
    "role": "Main DPS",
    "birthday": "December 2",
    "about": "Ganyu is a playable Cryo character in Genshin Impact, a half-qilin adeptus serving as the general secretary of the Liyue Qixing. Bound by a contract with the Geo Archon Morax, she handles administrative duties with diligence. Her adeptus heritage makes her feel distant from humans, causing social awkwardness. In battle, Ganyu is a powerful Main DPS, utilizing her charged bow attacks to deal massive Cryo damage.",
    "url_image": "https://wiki.hoyolab.com/_ipx/f_webp/https://bbs.hoyolab.com/hoyowiki/picture/character/%25E7%2594%2598%25E9%259B%25A8/avatar_header.png",
    "url_icon": "https://cdn.wanderer.moe/genshin-impact/character-icons/ui-avataricon-ganyu.png"
  },
  {
    "id": 4,
    "name": "Keqing",
    "element": "Electro",
    "rarity": 5,
    "weapon": "Sword",
    "region": "Liyue",
    "role": "Main DPS",
    "birthday": "November 20",
    "about": "Keqing is a playable Electro character in Genshin Impact, serving as the Yuheng of the Liyue Qixing. Known for her skepticism toward divine rule, she believes in human self-reliance and works tirelessly to modernize Liyue. Her pragmatic and decisive nature makes her a respected leader. In combat, Keqing excels as a Main DPS, delivering fast and powerful Electro attacks with her sword.",
    "url_image": "https://wiki.hoyolab.com/_ipx/f_webp/https://bbs.hoyolab.com/hoyowiki/picture/character/%25E5%2588%25BB%25E6%2599%25B4/avatar_header.jpg",
    "url_icon": "https://cdn.wanderer.moe/genshin-impact/character-icons/ui-avataricon-keqing.png"
  },
  {
    "id": 5,
    "name": "Raiden Shogun",
    "element": "Electro", 
    "rarity": 5,
    "weapon": "Polearm",
    "region": "Inazuma",
    "role": "Main DPS",
    "birthday": "June 26",
    "about": "Raiden Shogun, also known as Ei, is a playable Electro character in Genshin Impact and the Electro Archon of Inazuma. Ruling with an iron fist to achieve eternity, she resides in the Plane of Euthymia, using a puppet to govern. Her pursuit of eternity stems from personal loss, making her a complex figure. In battle, she is a formidable Main DPS, dealing massive Electro damage.",
    "url_image": "https://wiki.hoyolab.com/_ipx/f_webp/https://bbs.hoyolab.com/hoyowiki/picture/character/%25E9%259B%25B7%25E7%2594%25B5%25E5%25B0%2586%25E5%2586%259B/avatar_header.jpg",
    "url_icon": "https://cdn.wanderer.moe/genshin-impact/character-icons/ui-avataricon-shougun.png"
  },
  {
    "id": 6,
    "name": "Yae Miko",
    "element": "Electro",
    "rarity": 5,
    "weapon": "Catalyst",
    "region": "Inazuma",
    "role": "Sub-DPS",
    "birthday": "June 27",
    "about": "Yae Miko is a playable Electro character in Genshin Impact, serving as the Guuji of the Grand Narukami Shrine and Raiden Shogun's familiar. A cunning and witty kitsune, she oversees Inazuma's cultural affairs and runs the Yae Publishing House. Her playful demeanor hides a sharp intellect. In combat, Yae Miko excels as a Sub-DPS, deploying totems for consistent Electro damage.",
    "url_image": "https://wiki.hoyolab.com/_ipx/f_webp/https://bbs.hoyolab.com/hoyowiki/picture/character/%25E5%2585%25AB%25E9%2587%258D%25E7%25A5%259E%25E5%25AD%2590/avatar_header.png",
    "url_icon": "https://cdn.wanderer.moe/genshin-impact/character-icons/ui-avataricon-yae.png"
  },
  {
    "id": 7,
    "name": "Clorinde",
    "element": "Electro",
    "rarity": 5,
    "weapon": "Sword",
    "region": "Fontaine",
    "role": "Main DPS",
    "birthday": "September 20",
    "about": "Clorinde is a playable Electro character in Genshin Impact, known as Fontaine's strongest Champion Duelist. Serving as Furina's bodyguard, she upholds justice with unmatched swordsmanship. Her serious demeanor and loyalty to Fontaine define her character. In battle, Clorinde shines as a Main DPS, combining swift sword strikes with Electro-infused attacks for high damage output. // Add the config plugin to your app config file. The configuration must contain the path to the font file using fonts, android or ios properties which take an array of one or more font definitions. The path to each font file is relative to the project's root. The example below showcases all valid ways a font can be specified: as an array of objects that specify fontFamily and other properties, or an array of paths to font files. For Android, you can specify the fontFamily, weight, and optionally style (defaults to ), which will embed the fonts as native XML resources. If you provide only the font file paths in an array, the file name becomes the font family name on Android. iOS always extracts the font family name from the font file itself. If you plan to refer to fonts using just the fontFamily, provide an array of font paths (see FiraSans-MediumItalic.ttf below) and follow our recommendation for file naming. If you want to refer to fonts using a combination of fontFamily, weight, and style, provide an array of objects (see InterWhat is the website that multiplies words The website that offers a free Repeat Text Generator tool is a hreftexttoolsrepeattextgeneratorhelp seo toolsa It allows you to enter any text and... How do you copy a lot of text If you want to copy a lot of text the easiest way is to highlight all the text you want to copy and then use the copypaste method You can use the s... What is the online tool to repeat text The online tool to repeat text is the a hreftexttoolsrepeattextgeneratorRepeat Text Generator toola This tool lets you enter any text and specify h... How do I make my text repeat A a hreftexttoolsrepeattextgeneratorRepeat text generate a is a tool or program that is designed to generate repetitive or duplicated text content... How can I repeat times on Whatsapp just copy the content which you want to repeat times and paste it into the above box and enter the number how many times you want to repeat the sam... How do you repeat a chat on Whatsapp just copy chat from whatsapp and paste it into the above box and set the number on times you want to repeat and click on the generate button How can I send messages on WhatsApp just copy the messages which you want to repeat times repeated and paste them into the above box Enter numbers into the repeating box and click on... Global web icon StudyCorgi https://studycorgi.com › words 10000-Word Essay Samples: A+ Paper Examples for Free - StudyCorgi Don't know how to start a 10000-word essay? Get inspired with us! We've prepared a collection of 10000-word essay samples, as well as a number of handy writing tips. Global web icon Writecream https://www.writecream.com 10000 Words Generator AI [100% Free, No Login] - Writecream Creating long-form content can be time-consuming and challenging, but Writecream’s 10,000 Words Generator AI makes it effortless. This powerful tool helps users generate high-quality, structured … Explore this image Global web icon EduFixers https://edufixers.com › papers-by-wor… 10000 Words Essay Examples: Free Sample Papers … You will need to conduct an in-depth analysis in order to write a 10000-word essay. The keys to success are: meaningful research, a correctly formulated … People also ask What is a 10000-word essay? A 10000-word essay is a standard graduate-level college assignment. Its structure will depend on the discipline and institution. Moreover, a paper of 10000+ words is not necessarily an essay. A student might be assigned a research paper of such a length. The possible research fields might be psychology, marketing, economics, etc. 10000-Word Essay Samples: A+ Paper Examples for Free - StudyCorgi studycorgi.com Can you write a 10000-word paragraph? Obviously, you cannot write a 10000-word paragraph: it would be too challenging to read. Therefore, you should carefully structure your essay to ensure it’s logical and clear. Here’s a 10000-word essay outline you can follow: Introduction. It usually contains 800-1000 words. Main Body. 10000 Word Essay Examples + Topics for a 10000 Word Paper ivypanda.com How long does it take to write 10000 words? It will take you 3-7 hours to type 10000 words on your keyboard (the total time will depend on your typing speed). Writing an academic paper will take more time because you’ll have to research, make an outline, write, format, and edit your text. It would be best if you planned to spend around 33 and a half hours for a 10000-word paper. 10000 Word Essay Examples + Topics for a 10000 Word Paper ivypanda.com What is a 10000 word research paper? Moreover, a paper of 10000+ words is not necessarily an essay. A student might be assigned a research paper of such a length. The possible research fields might be psychology, marketing, economics, etc. This paper reviews the existing literature in support of the research study. 10000-Word Essay Samples: A+ Paper Examples for Free - StudyCorgi studycorgi.com How many pages in 10000 words? If you convert 10000 words to pages, you’ll get approximately 36 double-spaced or 18 single-spaced pages. This word count is common for thesis and dissertation assignments in college. Devote at least ten days to working on a 10000-word paper. 10000 Word Essay Examples + Topics for a 10000 Word Paper ivypanda.com Is a 10000 word essay Always an essay? A paper of 10000 words is not always an essay. Assignments of such a length are typical for graduate-level studies. The structure of a 10000 words essay will largely depend on the institution, the discipline, and your professor’s requirements. 10000 Words Essay Examples: Free Sample Papers on Any Topic - Edu… edufixers.com Feedback Explore this image Global web icon Interesting Engineering https://interestingengineering.com › i… New LongWriter AI LLM generates texts up to 10,000 … Aug 16, 2024 · To solve this problem, a team of AI researchers at Tsinghua University, working with a colleague from Zhipu AI, has developed a large … Explore this image Global web icon StudyMoose https://studymoose.com › essay-types 10000 word essay Examples - StudyMoose Jul 12, 2022 · How to write a 10000-words essay? - Topics Examples and Structure. How many pages and How Long Does It Take to Write a 10000 … Global web icon StudentShare https://studentshare.org The best examples of 10000 Word Essays - StudentShare Our 10000 word essay examples are perfect examples of papers with every word chosen carefully and placed in the right context. Follow our ideas as an example and polish your skills as an … Explore this image Global web icon Github https://github.com first20hours/google-10000-english - GitHub This repo contains a list of the 10,000 most common English words in order of frequency, as determined by n-gram frequency analysis of the Google's … Take a closer look at 10000 word text below).",
    "url_image": "https://act-upload.hoyoverse.com/event-ugc-hoyowiki/2024/04/23/35428890/b6a1e84770099dadf1d9ad2db68085f0_6110500522652843511.png?x-oss-process=image%2Fformat%2Cwebp",
    "url_icon": "https://static.wikia.nocookie.net/gensin-impact/images/5/5b/Clorinde_Icon.png/revision/latest?cb=20240605020849"
  },
  {
    "id": 8,
    "name": "Citlali",
    "element": "Cryo",
    "rarity": 5,
    "weapon": "Catalyst",
    "region": "Natlan",
    "role": "Support",
    "birthday": "Unknown",
    "about": "Citlali is a playable Cryo character in Genshin Impact, hailing from Natlan. As a member of the Shadowseekers, she uses her Cryo abilities to support her allies in battle. Little is known about her background, but her calm and strategic nature makes her a valuable team member. As a Support, Citlali enhances team performance with Cryo shields and buffs, ideal for elemental reactions.",
    "url_image": "https://act-upload.hoyoverse.com/event-ugc-hoyowiki/2025/01/01/35428890/c01202f24a387e63b50e74bfb61dad30_4645190191922745890.png?x-oss-process=image%2Fformat%2Cwebp",
    "url_icon": "https://static.wikia.nocookie.net/gensin-impact/images/d/dd/Citlali_Icon.png/revision/latest?cb=20241130080542"
  },
  {
    "id": 9,
    "name": "Chiori",
    "element": "Geo",
    "rarity": 5,
    "weapon": "Sword",
    "region": "Inazuma",
    "role": "Sub-DPS",
    "birthday": "August 17",
    "about": "Chiori is a playable Geo character in Genshin Impact, a renowned fashion designer from Inazuma who runs the Chioriya Boutique in Fontaine. Her sharp wit and dedication to her craft make her a standout figure. In combat, Chiori excels as a Sub-DPS, using Geo constructs and swift sword attacks to deal consistent damage while supporting her team.",
    "url_image": "https://act-upload.hoyoverse.com/event-ugc-hoyowiki/2024/01/29/94376896/7d0dc1fc0f1e49873b64f83d3a40ff42_2710370245430975974.png?x-oss-process=image%2Fformat%2Cwebp",
    "url_icon": "https://static.wikia.nocookie.net/gensin-impact/images/8/88/Chiori_Icon.png/revision/latest?cb=20240313015540"
  },
  {
    "id": 10,
    "name": "Eula",
    "element": "Cryo",
    "rarity": 5,
    "weapon": "Claymore",
    "region": "Mondstadt",
    "role": "Main DPS",
    "birthday": "October 25",
    "about": "Eula is a playable Cryo character in Genshin Impact, a descendant of the Lawrence Clan in Mondstadt. Despite her clan's tarnished reputation, she serves as a Captain in the Knights of Favonius, wielding her claymore with grace. Her rebellious spirit and sense of justice define her. As a Main DPS, Eula delivers devastating Cryo and physical damage with her burst.",
    "url_image": "https://wiki.hoyolab.com/_ipx/f_webp/https://bbs.hoyolab.com/hoyowiki/picture/character/%25E4%25BC%2598%25E8%258F%2588/avatar_header.png",
    "url_icon": "https://cdn.wanderer.moe/genshin-impact/character-icons/ui-avataricon-eula.png"
  },
  {
    "id": 11,
    "name": "Escoffier",
    "element": "Cryo",
    "rarity": 5,
    "weapon": "Polearm",
    "region": "Fontaine",
    "role": "Sub-DPS",
    "birthday": "Unknown",
    "about": "Escoffier is a character in Genshin Impact, mentioned in Fontaine's lore but not yet released as a playable character. Limited information exists about their role, element, or weapon. Speculated to be tied to Fontaine's culinary or cultural scene, Escoffier remains a mystery. Further details are needed to confirm their combat role and abilities.",
    "url_image": "https://act-webstatic.hoyoverse.com/event-static-hoyowiki-admin/2025/04/30/fd042ea5a978fa03586f67dda548e3e2_8964814933813360563.png?x-oss-process=image%2Fformat%2Cwebp",
    "url_icon": "https://static.wikia.nocookie.net/gensin-impact/images/2/2a/Escoffier_Icon.png/revision/latest?cb=20250507052556"
  },
  {
    "id": 12,
    "name": "Fischl",
    "element": "Electro",
    "rarity": 4,
    "weapon": "Bow",
    "region": "Mondstadt",
    "role": "Sub-DPS",
    "birthday": "May 27",
    "about": "Fischl is a playable Electro character in Genshin Impact, an eccentric investigator for the Adventurers' Guild in Mondstadt. Accompanied by her raven, Oz, she adopts the persona of 'Prinzessin der Verurteilung' from a fantasy novel. Her dramatic flair hides a kind heart. As a Sub-DPS, Fischl excels at dealing consistent Electro damage through Oz's abilities.",
    "url_image": "https://wiki.hoyolab.com/_ipx/f_webp/https://bbs.hoyolab.com/hoyowiki/picture/character/%25E8%258F%25B2%25E8%25B0%25A2%25E5%25B0%2594/avatar_header.jpg",
    "url_icon": "https://cdn.wanderer.moe/genshin-impact/character-icons/ui-avataricon-fischl.png"
  },
  {
    "id": 13,
    "name": "Kazuha",
    "element": "Anemo",
    "rarity": 5,
    "weapon": "Sword",
    "region": "Inazuma",
    "role": "Support",
    "birthday": "October 29",
    "about": "Kaedehara Kazuha is a playable Anemo character in Genshin Impact, a wandering samurai from Inazuma with a poetic soul. After losing his clan, he joins the Crux Fleet, using his Anemo abilities to sense nature's rhythms. His calm demeanor hides a fierce resolve. As a Support, Kazuha boosts elemental damage and provides crowd control with his swirl reactions.",
    "url_image": "https://wiki.hoyolab.com/_ipx/f_webp/https://bbs.hoyolab.com/hoyowiki/picture/character/%25E6%259E%25AB%25E5%258E%259F%25E4%25B8%2587%25E5%258F%25B6/avatar_header.png",
    "url_icon": "https://cdn.wanderer.moe/genshin-impact/character-icons/ui-avataricon-kazuha.png"
  },
  {
    "id": 14,
    "name": "Jean",
    "element": "Anemo",
    "rarity": 5,
    "weapon": "Sword",
    "region": "Mondstadt",
    "role": "Support",
    "birthday": "March 14",
    "about": "Jean is a playable Anemo character in Genshin Impact, serving as the Acting Grand Master of the Knights of Favonius in Mondstadt. Known for her dedication to protecting the city, she is a selfless leader who prioritizes duty. Her healing and crowd-control abilities make her a versatile Support, capable of cleansing debuffs and boosting team survivability with her Anemo-based skills. Jean's calm and composed nature hides a strong sense of responsibility.",
    "url_image": "https://wiki.hoyolab.com/_ipx/f_webp/https://bbs.hoyolab.com/hoyowiki/picture/character/%25E7%2590%25B4/avatar_header.jpg",
    "url_icon": "https://static.wikia.nocookie.net/gensin-impact/images/6/64/Jean_Icon.png/revision/latest?cb=20220602180528"
  },
  {
    "id": 15,
    "name": "Kamisato Ayaka",
    "element": "Cryo",
    "rarity": 5,
    "weapon": "Sword",
    "region": "Inazuma",
    "role": "Main DPS",
    "birthday": "September 28",
    "about": "Kamisato Ayaka is a playable Cryo character in Genshin Impact, the eldest daughter of the Kamisato Clan and a key figure in Inazuma's Yashiro Commission. Known for her elegance and grace, she upholds her family's honor while navigating political challenges. As a Main DPS, Ayaka excels in dealing Cryo damage with her charged attacks and powerful Elemental Burst, making her a top choice for Freeze and Permafrost teams.",
    "url_image": "https://wiki.hoyolab.com/_ipx/f_webp/https://bbs.hoyolab.com/hoyowiki/picture/character/%25E7%25A5%259E%25E9%2587%258C%25E7%25BB%25AB%25E5%258D%258E/avatar_header.png",
    "url_icon": "https://cdn.wanderer.moe/genshin-impact/character-icons/ui-avataricon-ayaka.png"
  },
  {
    "id": 16,
    "name": "Kinich",
    "element": "Dendro",
    "rarity": 5,
    "weapon": "Claymore",
    "region": "Natlan",
    "role": "Main DPS",
    "birthday": "October 2",
    "about": "Kinich is a playable Dendro character in Genshin Impact, a swift and agile warrior from Natlan. Known for his fast-paced claymore playstyle, he stands out among other claymore users with his unique mobility and Dendro application. Kinich's abilities focus on dealing high Dendro damage, making him a strong Main DPS for teams centered around Bloom and Hyperbloom reactions. His adventurous spirit defines his role in Natlan's lore.",
    "url_image": "https://act-upload.hoyoverse.com/event-ugc-hoyowiki/2024/09/15/35428890/eae1181b58088ab27017ed3d5925dc7e_8255678919577210960.png?x-oss-process=image%2Fformat%2Cwebp",
    "url_icon": "https://static.wikia.nocookie.net/gensin-impact/images/9/9a/Kinich_Icon.png/revision/latest?cb=20240917123836"
  },
  {
    "id": 17,
    "name": "Kirara",
    "element": "Dendro",
    "rarity": 4,
    "weapon": "Sword",
    "region": "Inazuma",
    "role": "Support",
    "birthday": "January 22",
    "about": "Kirara is a playable Dendro character in Genshin Impact, a nekomata courier working for Inazuma's Komaniya Express. Her playful and energetic personality, combined with her cat-like traits, makes her a fan favorite. As a Support, Kirara provides shields and Dendro application, enhancing Bloom and Hyperbloom teams. Her ability to climb and explore efficiently also makes her valuable for exploration in Teyvat.",
    "url_image": "https://upload-static.hoyoverse.com/hoyolab-wiki/2023/04/10/35428890/a8d5e9eaa6cc591c1c9cc7b15810a1ef_2828411651025563242.png?x-oss-process=image%2Fformat%2Cwebp",
    "url_icon": "https://static.wikia.nocookie.net/gensin-impact/images/b/b6/Kirara_Icon.png/revision/latest?cb=20230718042457"
  },
  {
    "id": 18,
    "name": "Klee",
    "element": "Pyro",
    "rarity": 5,
    "weapon": "Catalyst",
    "region": "Mondstadt",
    "role": "Main DPS",
    "birthday": "July 27",
    "about": "Klee is a playable Pyro character in Genshin Impact, a young member of the Knights of Favonius known for her love of explosives. Despite her childlike demeanor, she wields powerful Pyro attacks, making her a formidable Main DPS. Her bombs and charged attacks deal massive area-of-effect damage, ideal for Pyro-based teams. Klee's adventurous and mischievous nature often leads to chaos in Mondstadt.",
    "url_image": "https://wiki.hoyolab.com/_ipx/f_webp/https://bbs.hoyolab.com/hoyowiki/picture/character/%25E5%258F%25AF%25E8%258E%2589/avatar_header.jpg",
    "url_icon": "https://cdn.wanderer.moe/genshin-impact/character-icons/ui-avataricon-klee.png"
  },
  {
    "id": 19,
    "name": "Lisa",
    "element": "Electro",
    "rarity": 4,
    "weapon": "Catalyst",
    "region": "Mondstadt",
    "role": "Support",
    "birthday": "June 9",
    "about": "Lisa is a playable Electro character in Genshin Impact, a librarian for the Knights of Favonius and a former Sumeru Akademiya scholar. Known for her laid-back yet intelligent personality, she wields Electro with precision. As a Support, Lisa provides consistent Electro application and energy generation, making her valuable in Overload and Electro-Charged teams. Her knowledge and charm make her a beloved figure in Mondstadt.",
    "url_image": "https://wiki.hoyolab.com/_ipx/f_webp/https://bbs.hoyolab.com/hoyowiki/picture/character/%25E4%25B8%25BD%25E8%258E%258E/avatar_header.jpg",
    "url_icon": "https://cdn.wanderer.moe/genshin-impact/character-icons/ui-avataricon-lisa.png"
  },
  {
    "id": 20,
    "name": "Layla",
    "element": "Cryo",
    "rarity": 4,
    "weapon": "Sword",
    "region": "Sumeru",
    "role": "Support",
    "birthday": "December 19",
    "about": "Layla is a playable Cryo character in Genshin Impact, a student at Sumeru Akademiya known for her sleepwalking tendencies. Despite her shy and anxious nature, she excels at providing Cryo shields and off-field Cryo application. As a Support, Layla enhances Freeze and Melt teams with her reliable shielding and energy generation, making her a valuable addition to many team compositions.",
    "url_image": "https://upload-static.hoyoverse.com/hoyolab-wiki/2022/10/23/194600931/b98a830997595220620dd64e1a97988e_1708812270664859453.jpg?x-oss-process=image%2Fformat%2Cwebp",
    "url_icon": "https://cdn.wanderer.moe/genshin-impact/character-icons/ui-avataricon-layla.png"
  },
  {
    "id": 21,
    "name": "Lyney",
    "element": "Pyro",
    "rarity": 5,
    "weapon": "Bow",
    "region": "Fontaine",
    "role": "Main DPS",
    "birthday": "February 2",
    "about": "Lyney is a playable Pyro character in Genshin Impact, a charismatic magician from Fontaine and a member of the House of the Hearth. Known for his theatrical flair and loyalty to his sister Lynette, he uses his bow to deliver precise Pyro attacks. As a Main DPS, Lyney excels in dealing high single-target damage, making him ideal for Vaporize and Overload teams.",
    "url_image": "https://upload-static.hoyoverse.com/hoyolab-wiki/2023/07/19/35428890/46d2e1b2e8324dc2e5a3819acb93472c_8228967893981848203.png?x-oss-process=image%2Fformat%2Cwebp",
    "url_icon": "https://static.wikia.nocookie.net/gensin-impact/images/b/b2/Lyney_Icon.png/revision/latest?cb=20230816045203"
  },
  {
    "id": 22,
    "name": "Mavuika",
    "element": "Pyro",
    "rarity": 5,
    "weapon": "Claymore",
    "region": "Natlan",
    "role": "Main DPS",
    "birthday": "August 29",
    "about": "Mavuika is a playable Pyro character in Genshin Impact, the Pyro Archon of Natlan. Known for her fierce leadership and unique combat style involving a motorcycle, she delivers devastating Pyro damage. As a Main DPS, Mavuika excels in Vaporize and Overload teams, with her kit relying on allies' attacks to recharge her Ultimate. Her bold design and leadership make her a standout figure.",
    "url_image": "https://act-upload.hoyoverse.com/event-ugc-hoyowiki/2025/01/01/35428890/a3f1e6c42df5e749177e7a1a86e8d2f6_6008173553550914964.png?x-oss-process=image%2Fformat%2Cwebp",
    "url_icon": "https://static.wikia.nocookie.net/gensin-impact/images/d/da/Mavuika_Icon.png/revision/latest?cb=20250101070636"
  },
  {
    "id": 23,
    "name": "Mualani",
    "element": "Hydro",
    "rarity": 5,
    "weapon": "Catalyst",
    "region": "Natlan",
    "role": "Main DPS",
    "birthday": "August 15",
    "about": "Mualani is a playable Hydro character in Genshin Impact, a cheerful surfer from Natlan known for her water-based exploration abilities. Her kit focuses on Normal Attacks, delivering high Hydro damage for Vaporize teams. As a Main DPS, Mualani is easy to play and excels in exploration due to her stamina-free water surfing. Her vibrant personality shines in Natlan's lore.",
    "url_image": "https://act-upload.hoyoverse.com/event-ugc-hoyowiki/2024/08/27/35428890/dcdd1a4d23cefa853a06c2a8a0964ba1_7952207639060063651.png?x-oss-process=image%2Fformat%2Cwebp",
    "url_icon": "https://static.wikia.nocookie.net/gensin-impact/images/0/0b/Mualani_Icon.png/revision/latest?cb=20240828030235"
  },
  {
    "id": 24,
    "name": "Nahida",
    "element": "Dendro",
    "rarity": 5,
    "weapon": "Catalyst",
    "region": "Sumeru",
    "role": "Support",
    "birthday": "October 27",
    "about": "Nahida is a playable Dendro character in Genshin Impact, the Dendro Archon of Sumeru known as the Lesser Lord Kusanali. Despite her childlike appearance, she possesses immense wisdom and compassion. As a Support, Nahida excels in triggering Dendro reactions like Bloom and Hyperbloom, providing off-field damage and Elemental Mastery buffs, making her a cornerstone for Dendro teams.",
    "url_image": "https://upload-static.hoyoverse.com/hoyolab-wiki/2022/10/23/194600931/9b5ba3b232dd8000147bdfe93d5c8738_7298257796239165756.jpg?x-oss-process=image%2Fformat%2Cwebp",
    "url_icon": "https://cdn.wanderer.moe/genshin-impact/character-icons/ui-avataricon-nahida.png"
  },
  {
    "id": 25,
    "name": "Navia",
    "element": "Geo",
    "rarity": 5,
    "weapon": "Claymore",
    "region": "Fontaine",
    "role": "Main DPS",
    "birthday": "August 16",
    "about": "Navia is a playable Geo character in Genshin Impact, the president of the Spina di Rosula in Fontaine. Known for her cheerful yet determined personality, she seeks to uncover the truth behind her father's legacy. As a Main DPS, Navia deals high Geo damage with her claymore, utilizing Crystallize reactions to boost her damage output in Geo-centric teams.",
    "url_image": "https://upload-static.hoyoverse.com/hoyolab-wiki/2023/11/07/35428890/7ff6b93d261116d6bc6eac063895f316_6464363266680992210.png?x-oss-process=image%2Fformat%2Cwebp",
    "url_icon": "https://static.wikia.nocookie.net/gensin-impact/images/c/c0/Navia_Icon.png/revision/latest?cb=20231220022117"
  },
  {
    "id": 26,
    "name": "Nilou",
    "element": "Hydro",
    "rarity": 5,
    "weapon": "Sword",
    "region": "Sumeru",
    "role": "Sub-DPS",
    "birthday": "December 3",
    "about": "Nilou is a playable Hydro character in Genshin Impact, a dancer from Sumeru's Zubayr Theater. Her graceful performances hide a deep passion for her art. As a Sub-DPS, Nilou excels in Bloom reaction teams, boosting Bountiful Core damage with her Elemental Skill and Burst. Her kit is tailored for Hydro and Dendro synergy, making her a niche but powerful choice.",
    "url_image": "https://upload-static.hoyoverse.com/hoyolab-wiki/2022/09/13/194600931/84e8231fbc88421f5fc69f5a195655e5_3404530730991164572.png?x-oss-process=image%2Fformat%2Cwebp",
    "url_icon": "https://cdn.wanderer.moe/genshin-impact/character-icons/ui-avataricon-nilou.png"
  },
  {
    "id": 27,
    "name": "Neuvillette",
    "element": "Hydro",
    "rarity": 5,
    "weapon": "Catalyst",
    "region": "Fontaine",
    "role": "Main DPS",
    "birthday": "December 18",
    "about": "Neuvillette is a playable Hydro character in Genshin Impact, the Chief Justice of Fontaine. Known for his stoic demeanor and sense of justice, he wields immense Hydro power. As a Main DPS, Neuvillette delivers devastating charged attacks and consistent Hydro damage, making him a top choice for Vaporize and Hydro-based teams. His authority shapes Fontaine's legal system.",
    "url_image": "https://upload-static.hoyoverse.com/hoyolab-wiki/2023/08/14/151578876/6f8504896378e59f839f4486c3a21e4e_6712272435283914203.jpeg?x-oss-process=image%2Fformat%2Cwebp",
    "url_icon": "https://cdn.wanderer.moe/genshin-impact/character-icons/ui-avataricon-neuvillette.png"
  },
  {
    "id": 28,
    "name": "Ororon",
    "element": "Electro",
    "rarity": 4,
    "weapon": "Bow",
    "region": "Natlan",
    "role": "Support",
    "birthday": "November 9",
    "about": "Ororon is a playable Electro character in Genshin Impact, a member of Natlan's Masters of the Night-Wind. Known for his mysterious and rebellious nature, he uses his bow to support allies with Electro application and buffs. As a Support, Ororon enhances team damage through Electro reactions like Overload and Aggravate, while his mobility aids exploration.",
    "url_image": "https://act-upload.hoyoverse.com/event-ugc-hoyowiki/2024/11/19/35428890/ab3fbd5f3b937464cf87fb161aedc3d5_4032470641942095095.png?x-oss-process=image%2Fformat%2Cwebp",
    "url_icon": "https://static.wikia.nocookie.net/gensin-impact/images/5/5e/Ororon_Icon.png/revision/latest?cb=20241014100711"
  },
  {
    "id": 29,
    "name": "Sayu",
    "element": "Anemo",
    "rarity": 4,
    "weapon": "Claymore",
    "region": "Inazuma",
    "role": "Support",
    "birthday": "October 19",
    "about": "Sayu is a playable Anemo character in Genshin Impact, a ninja from Inazuma's Shuumatsuban. Her small stature and love for napping make her endearing, but she’s a skilled operative. As a Support, Sayu provides healing and Anemo swirl reactions, boosting elemental damage. Her rolling skill aids exploration, making her a versatile addition to many teams.",
    "url_image": "https://wiki.hoyolab.com/_ipx/f_webp/https://bbs.hoyolab.com/hoyowiki/picture/character/%25E6%2597%25A9%25E6%259F%259A/avatar_header.png",
    "url_icon": "https://cdn.wanderer.moe/genshin-impact/character-icons/ui-avataricon-sayu.png"
  },
  {
    "id": 30,
    "name": "Thoma",
    "element": "Pyro",
    "rarity": 4,
    "weapon": "Polearm",
    "region": "Inazuma",
    "role": "Support",
    "birthday": "January 9",
    "about": "Thoma is a playable Pyro character in Genshin Impact, a housekeeper for the Kamisato Clan in Inazuma. Originally from Mondstadt, his loyalty and warm personality make him a trusted ally. As a Support, Thoma provides shields and Pyro application, enhancing Vaporize and Overload teams. His protective nature shines in both combat and story.",
    "url_image": "https://wiki.hoyolab.com/_ipx/f_webp/https://bbs.hoyolab.com/hoyowiki/picture/character/%25E6%2589%2598%25E9%25A9%25AC/avatar_header.jpg",
    "url_icon": "https://cdn.wanderer.moe/genshin-impact/character-icons/ui-avataricon-tohma.png"
  },
  {
    "id": 31,
    "name": "Xiangling",
    "element": "Pyro",
    "rarity": 4,
    "weapon": "Polearm",
    "region": "Liyue",
    "role": "Sub-DPS",
    "birthday": "November 2",
    "about": "Xiangling is a playable Pyro character in Genshin Impact, a passionate chef from Liyue who runs the Wanmin Restaurant. Her culinary experiments often lead to explosive results. As a Sub-DPS, Xiangling excels in off-field Pyro application with her Elemental Burst, making her a staple in Vaporize and Overload teams. Her energy and creativity shine in battle.",
    "url_image": "https://wiki.hoyolab.com/_ipx/f_webp/https://bbs.hoyolab.com/hoyowiki/picture/character/%25E9%25A6%2599%25E8%258F%25B1/avatar_header.jpg",
    "url_icon": "https://cdn.wanderer.moe/genshin-impact/character-icons/ui-avataricon-xiangling.png"
  },
  {
    "id": 32,
    "name": "Xiao",
    "element": "Anemo",
    "rarity": 5,
    "weapon": "Polearm",
    "region": "Liyue",
    "role": "Main DPS",
    "birthday": "April 17",
    "about": "Xiao is a playable Anemo character in Genshin Impact, an adeptus and the last Yaksha guarding Liyue. Haunted by his past, he carries a heavy burden but remains fiercely protective. As a Main DPS, Xiao delivers high Anemo damage with his plunge attacks during his Elemental Burst, excelling in hypercarry teams with strong support.",
    "url_image": "https://wiki.hoyolab.com/_ipx/f_webp/https://bbs.hoyolab.com/hoyowiki/picture/character/%25E9%25AD%2588/avatar_header.jpg",
    "url_icon": "https://cdn.wanderer.moe/genshin-impact/character-icons/ui-avataricon-xiao.png"
  },
  {
    "id": 33,
    "name": "Xilonen",
    "element": "Geo",
    "rarity": 5,
    "weapon": "Sword",
    "region": "Natlan",
    "role": "Support",
    "birthday": "March 5",
    "about": "Xilonen is a playable Geo character in Genshin Impact, a skilled craftswoman from Natlan known for her versatility. As a Support, she provides shields, Elemental Resistance shred, and buffs, making her a game-changer for Geo teams. Her kit enhances elemental reactions and team synergy, while her exploration abilities, like climbing, add utility.",
    "url_image": "https://act-upload.hoyoverse.com/event-ugc-hoyowiki/2024/10/06/35428890/dbc29d62feb4b58daf578729d81c4c97_4756713406072385214.png?x-oss-process=image%2Fformat%2Cwebp",
    "url_icon": "https://static.wikia.nocookie.net/gensin-impact/images/a/ab/Xilonen_Icon.png/revision/latest?cb=20241009015637"
  },
  {
    "id": 34,
    "name": "Xingqiu",
    "element": "Hydro",
    "rarity": 4,
    "weapon": "Sword",
    "region": "Liyue",
    "role": "Sub-DPS",
    "birthday": "October 9",
    "about": "Xingqiu is a playable Hydro character in Genshin Impact, a young scholar and heir to the Feiyun Commerce Guild in Liyue. His love for books and chivalry defines his personality. As a Sub-DPS, Xingqiu excels in off-field Hydro application with his Elemental Burst, enabling Vaporize and Freeze reactions. His high energy cost is offset by his utility.",
    "url_image": "https://wiki.hoyolab.com/_ipx/f_webp/https://bbs.hoyolab.com/hoyowiki/picture/character/%25E8%25A1%258C%25E7%25A7%258B/avatar_header.jpg",
    "url_icon": "https://cdn.wanderer.moe/genshin-impact/character-icons/ui-avataricon-xingqiu.png"
  },
  {
    "id": 35,
    "name": "Yanfei",
    "element": "Pyro",
    "rarity": 4,
    "weapon": "Catalyst",
    "region": "Liyue",
    "role": "Main DPS",
    "birthday": "July 28",
    "about": "Yanfei is a playable Pyro character in Genshin Impact, a legal advisor in Liyue with adeptus heritage. Her sharp intellect and fiery personality make her a standout. As a Main DPS, Yanfei delivers consistent Pyro damage with her charged attacks, excelling in Vaporize teams. Her knowledge of law and combat prowess make her a reliable ally.",
    "url_image": "https://wiki.hoyolab.com/_ipx/f_webp/https://bbs.hoyolab.com/hoyowiki/picture/character/%25E7%2583%259F%25E7%25BB%25AF/avatar_header.png",
    "url_icon": "https://cdn.wanderer.moe/genshin-impact/character-icons/ui-avataricon-feiyan.png"
  },
  {
    "id": 36,
    "name": "Yelan",
    "element": "Hydro",
    "rarity": 5,
    "weapon": "Bow",
    "region": "Liyue",
    "role": "Sub-DPS",
    "birthday": "April 20",
    "about": "Yelan is a playable Hydro character in Genshin Impact, a mysterious intelligence agent from Liyue. Known for her cunning and agility, she operates in the shadows. As a Sub-DPS, Yelan provides off-field Hydro application and high damage with her Elemental Burst, rivaling Xingqiu in Vaporize and Freeze teams. Her exploration abilities are also top-tier.",
    "url_image": "https://wiki.hoyolab.com/_ipx/f_webp/https://bbs.hoyolab.com/hoyowiki/picture/character/%25E5%25A4%259C%25E5%2585%25B0/avatar_header.jpg",
    "url_icon": "https://cdn.wanderer.moe/genshin-impact/character-icons/ui-avataricon-yelan.png"
  },
  {
    "id": 37,
    "name": "Razor",
    "element": "Electro",
    "rarity": 4,
    "weapon": "Claymore",
    "region": "Mondstadt",
    "role": "Main DPS",
    "birthday": "September 9",
    "about": "Razor is a playable Electro character in Genshin Impact, a boy raised by wolves in Mondstadt's Wolvendom. His feral nature and loyalty to his pack define him. As a Main DPS, Razor excels in dealing physical and Electro damage with his claymore, making him a strong choice for physical damage-focused teams with Superconduct support.",
    "url_image": "https://wiki.hoyolab.com/_ipx/f_webp/https://bbs.hoyolab.com/hoyowiki/picture/character/%25E9%259B%25B7%25E6%25B3%25BD/avatar_header.jpg",
    "url_icon": "https://cdn.wanderer.moe/genshin-impact/character-icons/ui-avataricon-razor.png"
  },
  {
    "id": 38,
    "name": "Kuki Shinobu",
    "element": "Electro",
    "rarity": 4,
    "weapon": "Sword",
    "region": "Inazuma",
    "role": "Support",
    "birthday": "May 27",
    "about": "Kuki Shinobu is a playable Electro character in Genshin Impact, the deputy leader of the Arataki Gang in Inazuma. A skilled ninja with a calm demeanor, she balances her gang's antics. As a Support, Shinobu provides healing and off-field Electro application, excelling in Hyperbloom and Aggravate teams with her Elemental Mastery-focused kit.",
    "url_image": "https://wiki.hoyolab.com/_ipx/f_webp/https://bbs.hoyolab.com/hoyowiki/picture/character/%25E4%25B9%2585%25E5%25B2%2590%25E5%25BF%258D/avatar_header.jpg",
    "url_icon": "https://cdn.wanderer.moe/genshin-impact/character-icons/ui-avataricon-shinobu.png"
  },
  {
    "id": 39,
    "name": "Faruzan",
    "element": "Anemo",
    "rarity": 4,
    "weapon": "Bow",
    "region": "Sumeru",
    "role": "Support",
    "birthday": "August 20",
    "about": "Faruzan is a playable Anemo character in Genshin Impact, a scholar from Sumeru Akademiya with a passion for ancient mechanics. Trapped for decades, she brings a youthful spirit. As a Support, Faruzan boosts Anemo damage and provides crowd control with her Elemental Burst, making her a key addition to Anemo DPS teams like Xiao.",
    "url_image": "https://upload-static.hoyoverse.com/hoyolab-wiki/2022/11/02/35428890/916f58fd40889efeb93579a425282b34_5236500299635330845.jpg?x-oss-process=image%2Fformat%2Cwebp",
    "url_icon": "https://cdn.wanderer.moe/genshin-impact/character-icons/ui-avataricon-faruzan.png"
  }
]